approved_at_utc,approved_by,archived,author,author_flair_background_color,author_flair_css_class,author_flair_richtext,author_flair_template_id,author_flair_text,author_flair_text_color,author_flair_type,author_fullname,banned_at_utc,banned_by,can_gild,can_mod_post,category,clicked,content_categories,contest_mode,created,created_utc,distinguished,domain,downs,edited,gilded,hidden,hide_score,id,is_crosspostable,is_meta,is_original_content,is_reddit_media_domain,is_self,is_video,likes,link_flair_background_color,link_flair_css_class,link_flair_richtext,link_flair_template_id,link_flair_text,link_flair_text_color,link_flair_type,locked,media,media_embed,media_only,mod_note,mod_reason_by,mod_reason_title,mod_reports,name,no_follow,num_comments,num_crossposts,num_reports,over_18,parent_whitelist_status,permalink,pinned,pwls,quarantine,removal_reason,report_reasons,saved,score,secure_media,secure_media_embed,selftext,selftext_html,send_replies,spoiler,stickied,subreddit,subreddit_id,subreddit_name_prefixed,subreddit_subscribers,subreddit_type,suggested_sort,thumbnail,title,ups,url,user_reports,view_count,visited,whitelist_status,wls
,,False,Foodiedarkside,,,[],,,,text,t2_21n3bjb2,,,False,False,,False,,False,1535055929.0,1535027129.0,,self.royalfamily,0,False,0,False,False,99mxuj,False,False,False,False,True,False,,,,[],,,dark,text,False,,{},False,,,,[],t3_99mxuj,True,1,0,,False,,/r/royalfamily/comments/99mxuj/prince_jeffri/,False,,False,,,False,1,,{},"Im just curious to know , how much money he’s got after they took almost everything from him., 
And i also heard from the grapevine that his daughters ( from other wives) are about a billion dollars worth a piece 
How fucking wealthy ($1 billion inheritance per daughter)","&lt;!-- SC_OFF --&gt;&lt;div class=""md""&gt;&lt;p&gt;Im just curious to know , how much money he’s got after they took almost everything from him., 
And i also heard from the grapevine that his daughters ( from other wives) are about a billion dollars worth a piece 
How fucking wealthy ($1 billion inheritance per daughter)&lt;/p&gt;
&lt;/div&gt;&lt;!-- SC_ON --&gt;",True,False,False,royalfamily,t5_2xyim,r/royalfamily,751,public,,,Prince jeffri?,1,https://www.reddit.com/r/royalfamily/comments/99mxuj/prince_jeffri/,[],,False,,
,,False,njsamps,,,[],,,,text,t2_xur1u2o,,,False,False,,False,,False,1535019505.0,1534990705.0,,self.royalfamily,0,False,0,False,False,99jhep,False,False,False,False,True,False,,,,[],,,dark,text,False,,{},False,,,,[],t3_99jhep,True,1,0,,False,,/r/royalfamily/comments/99jhep/foreign_honours_of_the_royal_family/,False,,False,,,False,2,,{},"Something that always interested me about the Royal Family — and all royal families for that matter. 

What do they do with all the regalia of foreign honours they receive? Do they sit in a storage until the next visit? Are they ever worn “normally?”","&lt;!-- SC_OFF --&gt;&lt;div class=""md""&gt;&lt;p&gt;Something that always interested me about the Royal Family — and all royal families for that matter. &lt;/p&gt;

&lt;p&gt;What do they do with all the regalia of foreign honours they receive? Do they sit in a storage until the next visit? Are they ever worn “normally?”&lt;/p&gt;
&lt;/div&gt;&lt;!-- SC_ON --&gt;",True,False,False,royalfamily,t5_2xyim,r/royalfamily,751,public,,,Foreign Honours of the Royal Family?,2,https://www.reddit.com/r/royalfamily/comments/99jhep/foreign_honours_of_the_royal_family/,[],,False,,
,,False,Curmudgy,,,[],,,,text,t2_ktluv,,,False,False,,False,,False,1534743074.0,1534714274.0,,self.royalfamily,0,False,0,False,False,98nrpw,False,False,False,False,True,False,,,,[],,,dark,text,False,,{},False,,,,[],t3_98nrpw,False,4,0,,False,,/r/royalfamily/comments/98nrpw/how_soon_might_charles_make_william_prince_of/,False,,False,,,False,6,,{},"Within my long answer [in this thread](https://www.reddit.com/r/NoStupidQuestions/comments/98kv47/when_prince_charles_becomes_king_prince_william/), I went out on  limb and said I didn’t expect Charles to make William the Prince of Wales until after Charles’s own coronation.  But I’m just guessing, basing it on the idea that the coronation is usually after a suitable mourning period for the previous monarch, and that giving out the honor to Prince William should also wait for that purpose. 

Has anyone seen any speculation on this?  Or wish to make their own guesses?","&lt;!-- SC_OFF --&gt;&lt;div class=""md""&gt;&lt;p&gt;Within my long answer &lt;a href=""https://www.reddit.com/r/NoStupidQuestions/comments/98kv47/when_prince_charles_becomes_king_prince_william/""&gt;in this thread&lt;/a&gt;, I went out on  limb and said I didn’t expect Charles to make William the Prince of Wales until after Charles’s own coronation.  But I’m just guessing, basing it on the idea that the coronation is usually after a suitable mourning period for the previous monarch, and that giving out the honor to Prince William should also wait for that purpose. &lt;/p&gt;

&lt;p&gt;Has anyone seen any speculation on this?  Or wish to make their own guesses?&lt;/p&gt;
&lt;/div&gt;&lt;!-- SC_ON --&gt;",True,False,False,royalfamily,t5_2xyim,r/royalfamily,751,public,,,How soon might Charles make William Prince of Wales?,6,https://www.reddit.com/r/royalfamily/comments/98nrpw/how_soon_might_charles_make_william_prince_of/,[],,False,,
,,False,CapriciousSalmon,,,[],,,,text,t2_1cx1dvzg,,,False,False,,False,,False,1534676852.0,1534648052.0,,self.royalfamily,0,False,0,False,False,98ha3e,False,False,False,False,True,False,,,,[],,,dark,text,False,,{},False,,,,[],t3_98ha3e,True,6,0,,False,,/r/royalfamily/comments/98ha3e/what_would_prince_phillips_title_be_if_he/,False,,False,,,False,8,,{},Would he be a dowager? How would it work?,"&lt;!-- SC_OFF --&gt;&lt;div class=""md""&gt;&lt;p&gt;Would he be a dowager? How would it work?&lt;/p&gt;
&lt;/div&gt;&lt;!-- SC_ON --&gt;",True,False,False,royalfamily,t5_2xyim,r/royalfamily,751,public,,,What would Prince Phillip’s title be if he outlived Elizabeth?,8,https://www.reddit.com/r/royalfamily/comments/98ha3e/what_would_prince_phillips_title_be_if_he/,[],,False,,
,,False,Degreeme,,,[],,,,text,t2_15cloedm,,,False,False,,False,,False,1534586256.0,1534557456.0,,self.royalfamily,0,False,0,False,False,9882sq,False,False,False,False,True,False,,,,[],,,dark,text,False,,{},False,,,,[],t3_9882sq,True,2,0,,False,,/r/royalfamily/comments/9882sq/was_tony_a_commoner/,False,,False,,,False,3,,{},"I saw that Kate was the first commoner to marry into the royal family in 350 years. Wasn’t Tony, Princess Margaret’s husband, also a commoner before he was given a title for marrying her?","&lt;!-- SC_OFF --&gt;&lt;div class=""md""&gt;&lt;p&gt;I saw that Kate was the first commoner to marry into the royal family in 350 years. Wasn’t Tony, Princess Margaret’s husband, also a commoner before he was given a title for marrying her?&lt;/p&gt;
&lt;/div&gt;&lt;!-- SC_ON --&gt;",True,False,False,royalfamily,t5_2xyim,r/royalfamily,751,public,,,Was Tony a commoner?,3,https://www.reddit.com/r/royalfamily/comments/9882sq/was_tony_a_commoner/,[],,False,,
,,False,indigo_prime,,,[],,,,text,t2_bahty,,,False,False,,False,,False,1532120586.0,1532091786.0,,self.royalfamily,0,False,0,False,False,90fsp5,False,False,False,False,True,False,,,,[],,,dark,text,False,,{},False,,,,[],t3_90fsp5,False,5,0,,False,,/r/royalfamily/comments/90fsp5/prince_philip_dead/,False,,False,,,False,16,,{},"Someone I know works in a place that has a lot of connections to the Royal Family and there are a lot of hushed whispers around the building that Prince Philip has passed away.  Nothing in the news at the moment to support it though....so.....speculation?

He certainly hasn't been in the best of health recently :/","&lt;!-- SC_OFF --&gt;&lt;div class=""md""&gt;&lt;p&gt;Someone I know works in a place that has a lot of connections to the Royal Family and there are a lot of hushed whispers around the building that Prince Philip has passed away.  Nothing in the news at the moment to support it though....so.....speculation?&lt;/p&gt;

&lt;p&gt;He certainly hasn&amp;#39;t been in the best of health recently :/&lt;/p&gt;
&lt;/div&gt;&lt;!-- SC_ON --&gt;",True,False,False,royalfamily,t5_2xyim,r/royalfamily,751,public,,,Prince Philip Dead?,16,https://www.reddit.com/r/royalfamily/comments/90fsp5/prince_philip_dead/,[],,False,,
,,False,mall980,,,[],,,,text,t2_1d85opyd,,,False,False,,False,,False,1530102433.0,1530073633.0,,youtu.be,0,False,0,False,False,8u6oax,False,False,False,False,False,False,,,,[],,,dark,text,False,"{'oembed': {'provider_url': 'https://www.youtube.com/', 'version': '1.0', 'title': 'Stars join royals at awards ceremony honouring inspirational young leaders', 'author_name': 'celebrity news Update', 'height': 338, 'width': 600, 'html': '&lt;iframe width=""600"" height=""338"" src=""https://www.youtube.com/embed/z-MbU31VKkc?feature=oembed&amp;enablejsapi=1"" frameborder=""0"" allow=""autoplay; encrypted-media"" allowfullscreen&gt;&lt;/iframe&gt;', 'thumbnail_width': 480, 'thumbnail_height': 360, 'thumbnail_url': 'https://i.ytimg.com/vi/z-MbU31VKkc/hqdefault.jpg', 'type': 'video', 'provider_name': 'YouTube', 'author_url': 'https://www.youtube.com/channel/UC35Q5jF4SJH57lC52v7W4ZQ'}, 'type': 'youtube.com'}","{'content': '&lt;iframe width=""600"" height=""338"" src=""https://www.youtube.com/embed/z-MbU31VKkc?feature=oembed&amp;enablejsapi=1"" frameborder=""0"" allow=""autoplay; encrypted-media"" allowfullscreen&gt;&lt;/iframe&gt;', 'width': 600, 'scrolling': False, 'height': 338}",False,,,,[],t3_8u6oax,True,0,0,,False,,/r/royalfamily/comments/8u6oax/stars_join_royals_at_awards_ceremony_honouring/,False,,False,,,False,7,"{'oembed': {'provider_url': 'https://www.youtube.com/', 'version': '1.0', 'title': 'Stars join royals at awards ceremony honouring inspirational young leaders', 'author_name': 'celebrity news Update', 'height': 338, 'width': 600, 'html': '&lt;iframe width=""600"" height=""338"" src=""https://www.youtube.com/embed/z-MbU31VKkc?feature=oembed&amp;enablejsapi=1"" frameborder=""0"" allow=""autoplay; encrypted-media"" allowfullscreen&gt;&lt;/iframe&gt;', 'thumbnail_width': 480, 'thumbnail_height': 360, 'thumbnail_url': 'https://i.ytimg.com/vi/z-MbU31VKkc/hqdefault.jpg', 'type': 'video', 'provider_name': 'YouTube', 'author_url': 'https://www.youtube.com/channel/UC35Q5jF4SJH57lC52v7W4ZQ'}, 'type': 'youtube.com'}","{'content': '&lt;iframe width=""600"" height=""338"" src=""https://www.youtube.com/embed/z-MbU31VKkc?feature=oembed&amp;enablejsapi=1"" frameborder=""0"" allow=""autoplay; encrypted-media"" allowfullscreen&gt;&lt;/iframe&gt;', 'width': 600, 'scrolling': False, 'media_domain_url': 'https://www.redditmedia.com/mediaembed/8u6oax', 'height': 338}",,,True,False,False,royalfamily,t5_2xyim,r/royalfamily,751,public,,,Stars join royals at awards ceremony honouring inspirational young leaders,7,https://youtu.be/z-MbU31VKkc,[],,False,,
,,False,SensationallylovelyK,,,[],,,,text,t2_1kf83mw7,,,False,False,,False,,False,1529362858.0,1529334058.0,,i.redd.it,0,False,0,False,False,8s064p,False,False,False,True,False,False,,,,[],,,dark,text,False,,{},False,,,,[],t3_8s064p,False,1,0,,False,,/r/royalfamily/comments/8s064p/who_else_is_anxiously_awaiting_the_first_official/,False,,False,,,False,18,,{},,,True,False,False,royalfamily,t5_2xyim,r/royalfamily,751,public,,,Who else is anxiously awaiting the first official photograph of the Cambridge family now that a new fifth member has arrived??,18,https://i.redd.it/7zbopcrtxr411.jpg,[],,False,,
,,False,lalymorgan,,,[],,,,text,t2_1leetdsr,,,False,False,,False,,False,1529339227.0,1529310427.0,,self.royalfamily,0,False,0,False,False,8rxwjj,False,False,False,False,True,False,,,,[],,,dark,text,False,,{},False,,,,[],t3_8rxwjj,True,5,0,,False,,/r/royalfamily/comments/8rxwjj/my_theory_on_meghan_markles_wardrobe_choices/,False,,False,,,False,14,,{},"Ever since she stepped out of the car on her wedding day, Meghan Markle - and her dressing style - have been the center of attention. But there is something that seems odd, doesn't it? Being the stylish actress that she has always been. it would seem logical to expect her to be always a fashion icon, but she seems to disappointing lots of people with her wardrobe choices. Starting off with a wedding dress that seemed ""loose"" or ""plain"" and then with nude dresses for her public appearances, she is toning down her fashionista image.

It seems to me that Meghan is trying to let go of her Hollywood actress image, and trying to transcend into a more mature and complete persona. It seems that she is trying to make a statement in which *she* gets to shine, not her style. Right now, she is dressing appropriately, with simple colors and lines, trying to fit in in a really conservative and formal environment that is nothing like the red carpets she was used to attending (where it was more important the *""who are you wearing?""* than the person herself).

Hollywood actors are known for their work, their style, the things they did or didn't do. Royals, on the other hand, are known for just being who they are (little baby Louis has never ever spoken and everybody knows who he is). Meghan is transitioning from her Hollywood persona (marked very strongly for her fashion sense) to an image where what matters the most is her personality and her passion for things beyond clothing, such as charity.

\- Laura","&lt;!-- SC_OFF --&gt;&lt;div class=""md""&gt;&lt;p&gt;Ever since she stepped out of the car on her wedding day, Meghan Markle - and her dressing style - have been the center of attention. But there is something that seems odd, doesn&amp;#39;t it? Being the stylish actress that she has always been. it would seem logical to expect her to be always a fashion icon, but she seems to disappointing lots of people with her wardrobe choices. Starting off with a wedding dress that seemed &amp;quot;loose&amp;quot; or &amp;quot;plain&amp;quot; and then with nude dresses for her public appearances, she is toning down her fashionista image.&lt;/p&gt;

&lt;p&gt;It seems to me that Meghan is trying to let go of her Hollywood actress image, and trying to transcend into a more mature and complete persona. It seems that she is trying to make a statement in which &lt;em&gt;she&lt;/em&gt; gets to shine, not her style. Right now, she is dressing appropriately, with simple colors and lines, trying to fit in in a really conservative and formal environment that is nothing like the red carpets she was used to attending (where it was more important the &lt;em&gt;&amp;quot;who are you wearing?&amp;quot;&lt;/em&gt; than the person herself).&lt;/p&gt;

&lt;p&gt;Hollywood actors are known for their work, their style, the things they did or didn&amp;#39;t do. Royals, on the other hand, are known for just being who they are (little baby Louis has never ever spoken and everybody knows who he is). Meghan is transitioning from her Hollywood persona (marked very strongly for her fashion sense) to an image where what matters the most is her personality and her passion for things beyond clothing, such as charity.&lt;/p&gt;

&lt;p&gt;- Laura&lt;/p&gt;
&lt;/div&gt;&lt;!-- SC_ON --&gt;",True,False,False,royalfamily,t5_2xyim,r/royalfamily,751,public,,,My theory on Meghan Markle's wardrobe choices,14,https://www.reddit.com/r/royalfamily/comments/8rxwjj/my_theory_on_meghan_markles_wardrobe_choices/,[],,False,,
,,False,EllySpace,,,[],,,,text,t2_1iwocna4,,,False,False,,False,,False,1528608965.0,1528580165.0,,youtube.com,0,False,0,False,False,8pw3jg,False,False,False,False,False,False,,,,[],,,dark,text,False,"{'type': 'youtube.com', 'oembed': {'provider_url': 'https://www.youtube.com/', 'title': 'Elly Space - Her Majesty', 'html': '&lt;iframe width=""600"" height=""338"" src=""https://www.youtube.com/embed/HEsI_Xp7lc0?feature=oembed&amp;enablejsapi=1"" frameborder=""0"" allow=""autoplay; encrypted-media"" allowfullscreen&gt;&lt;/iframe&gt;', 'thumbnail_width': 480, 'height': 338, 'width': 600, 'version': '1.0', 'author_name': 'Elly Space', 'provider_name': 'YouTube', 'thumbnail_url': 'https://i.ytimg.com/vi/HEsI_Xp7lc0/hqdefault.jpg', 'type': 'video', 'thumbnail_height': 360, 'author_url': 'https://www.youtube.com/channel/UCifjAZKw-K-ZkatV0XBqHAw'}}","{'content': '&lt;iframe width=""600"" height=""338"" src=""https://www.youtube.com/embed/HEsI_Xp7lc0?feature=oembed&amp;enablejsapi=1"" frameborder=""0"" allow=""autoplay; encrypted-media"" allowfullscreen&gt;&lt;/iframe&gt;', 'width': 600, 'scrolling': False, 'height': 338}",False,,,,[],t3_8pw3jg,True,0,0,,False,,/r/royalfamily/comments/8pw3jg/song_inspired_by_the_queen_her_majesty/,False,,False,,,False,4,"{'type': 'youtube.com', 'oembed': {'provider_url': 'https://www.youtube.com/', 'title': 'Elly Space - Her Majesty', 'html': '&lt;iframe width=""600"" height=""338"" src=""https://www.youtube.com/embed/HEsI_Xp7lc0?feature=oembed&amp;enablejsapi=1"" frameborder=""0"" allow=""autoplay; encrypted-media"" allowfullscreen&gt;&lt;/iframe&gt;', 'thumbnail_width': 480, 'height': 338, 'width': 600, 'version': '1.0', 'author_name': 'Elly Space', 'provider_name': 'YouTube', 'thumbnail_url': 'https://i.ytimg.com/vi/HEsI_Xp7lc0/hqdefault.jpg', 'type': 'video', 'thumbnail_height': 360, 'author_url': 'https://www.youtube.com/channel/UCifjAZKw-K-ZkatV0XBqHAw'}}","{'content': '&lt;iframe width=""600"" height=""338"" src=""https://www.youtube.com/embed/HEsI_Xp7lc0?feature=oembed&amp;enablejsapi=1"" frameborder=""0"" allow=""autoplay; encrypted-media"" allowfullscreen&gt;&lt;/iframe&gt;', 'width': 600, 'scrolling': False, 'media_domain_url': 'https://www.redditmedia.com/mediaembed/8pw3jg', 'height': 338}",,,True,False,False,royalfamily,t5_2xyim,r/royalfamily,751,public,,,Song inspired by the Queen - Her Majesty,4,https://www.youtube.com/watch?v=HEsI_Xp7lc0,[],,False,,
,,False,whostars,,,[],,,,text,t2_1h7ece20,,,False,False,,False,,False,1528612377.0,1528583577.0,,youtube.com,0,False,0,False,False,8pwgpw,False,False,False,False,False,False,,,,[],,,dark,text,False,"{'oembed': {'provider_url': 'https://www.youtube.com/', 'description': 'Thanks for watching my video. If you like my videos, please subscribe to the channel to receive the latest videos : https://goo.gl/3uVRJc Blogger : https://goo.gl/wBUcx3 Facebook : https://goo.gl/rdSorv Videos can use content-based copyright law contains reasonable use Fair Use (https://www.youtube.com/yt/copyright/). For any copyright, please send me a message.', 'title': 'Princess Charlotte SLIPS', 'url': 'http://www.youtube.com/watch?v=f5wTS0986po', 'type': 'video', 'author_name': 'Who Stars', 'height': 338, 'width': 600, 'html': '&lt;iframe class=""embedly-embed"" src=""https://cdn.embedly.com/widgets/media.html?src=https%3A%2F%2Fwww.youtube.com%2Fembed%2Ff5wTS0986po%3Ffeature%3Doembed&amp;url=http%3A%2F%2Fwww.youtube.com%2Fwatch%3Fv%3Df5wTS0986po&amp;image=https%3A%2F%2Fi.ytimg.com%2Fvi%2Ff5wTS0986po%2Fhqdefault.jpg&amp;key=522baf40bd3911e08d854040d3dc5c07&amp;type=text%2Fhtml&amp;schema=youtube"" width=""600"" height=""338"" scrolling=""no"" frameborder=""0"" allowfullscreen&gt;&lt;/iframe&gt;', 'thumbnail_width': 480, 'version': '1.0', 'provider_name': 'YouTube', 'thumbnail_url': 'https://i.ytimg.com/vi/f5wTS0986po/hqdefault.jpg', 'thumbnail_height': 360, 'author_url': 'https://www.youtube.com/channel/UCm3nSHO93yj1qsqcz9VrNwg'}, 'type': 'youtube.com'}","{'content': '&lt;iframe class=""embedly-embed"" src=""https://cdn.embedly.com/widgets/media.html?src=https%3A%2F%2Fwww.youtube.com%2Fembed%2Ff5wTS0986po%3Ffeature%3Doembed&amp;url=http%3A%2F%2Fwww.youtube.com%2Fwatch%3Fv%3Df5wTS0986po&amp;image=https%3A%2F%2Fi.ytimg.com%2Fvi%2Ff5wTS0986po%2Fhqdefault.jpg&amp;key=522baf40bd3911e08d854040d3dc5c07&amp;type=text%2Fhtml&amp;schema=youtube"" width=""600"" height=""338"" scrolling=""no"" frameborder=""0"" allowfullscreen&gt;&lt;/iframe&gt;', 'width': 600, 'scrolling': False, 'height': 338}",False,,,,[],t3_8pwgpw,False,0,0,,False,,/r/royalfamily/comments/8pwgpw/princess_charlotte_slips/,False,,False,,,False,1,"{'oembed': {'provider_url': 'https://www.youtube.com/', 'description': 'Thanks for watching my video. If you like my videos, please subscribe to the channel to receive the latest videos : https://goo.gl/3uVRJc Blogger : https://goo.gl/wBUcx3 Facebook : https://goo.gl/rdSorv Videos can use content-based copyright law contains reasonable use Fair Use (https://www.youtube.com/yt/copyright/). For any copyright, please send me a message.', 'title': 'Princess Charlotte SLIPS', 'url': 'http://www.youtube.com/watch?v=f5wTS0986po', 'type': 'video', 'author_name': 'Who Stars', 'height': 338, 'width': 600, 'html': '&lt;iframe class=""embedly-embed"" src=""https://cdn.embedly.com/widgets/media.html?src=https%3A%2F%2Fwww.youtube.com%2Fembed%2Ff5wTS0986po%3Ffeature%3Doembed&amp;url=http%3A%2F%2Fwww.youtube.com%2Fwatch%3Fv%3Df5wTS0986po&amp;image=https%3A%2F%2Fi.ytimg.com%2Fvi%2Ff5wTS0986po%2Fhqdefault.jpg&amp;key=522baf40bd3911e08d854040d3dc5c07&amp;type=text%2Fhtml&amp;schema=youtube"" width=""600"" height=""338"" scrolling=""no"" frameborder=""0"" allowfullscreen&gt;&lt;/iframe&gt;', 'thumbnail_width': 480, 'version': '1.0', 'provider_name': 'YouTube', 'thumbnail_url': 'https://i.ytimg.com/vi/f5wTS0986po/hqdefault.jpg', 'thumbnail_height': 360, 'author_url': 'https://www.youtube.com/channel/UCm3nSHO93yj1qsqcz9VrNwg'}, 'type': 'youtube.com'}","{'content': '&lt;iframe class=""embedly-embed"" src=""https://cdn.embedly.com/widgets/media.html?src=https%3A%2F%2Fwww.youtube.com%2Fembed%2Ff5wTS0986po%3Ffeature%3Doembed&amp;url=http%3A%2F%2Fwww.youtube.com%2Fwatch%3Fv%3Df5wTS0986po&amp;image=https%3A%2F%2Fi.ytimg.com%2Fvi%2Ff5wTS0986po%2Fhqdefault.jpg&amp;key=522baf40bd3911e08d854040d3dc5c07&amp;type=text%2Fhtml&amp;schema=youtube"" width=""600"" height=""338"" scrolling=""no"" frameborder=""0"" allowfullscreen&gt;&lt;/iframe&gt;', 'width': 600, 'scrolling': False, 'media_domain_url': 'https://www.redditmedia.com/mediaembed/8pwgpw', 'height': 338}",,,True,False,False,royalfamily,t5_2xyim,r/royalfamily,751,public,,,Princess Charlotte SLIPS,1,https://www.youtube.com/attribution_link?a=u8LFXCO4UbU&amp;u=%2Fwatch%3Fv%3Df5wTS0986po%26feature%3Dshare,[],,False,,
,,False,KaliumOxid,,,[],,,,text,t2_noo1byo,,,False,False,,False,,False,1528168192.0,1528139392.0,,self.royalfamily,0,False,0,False,False,8ojyya,False,False,False,False,True,False,,,,[],,,dark,text,False,,{},False,,,,[],t3_8ojyya,True,4,0,,False,,/r/royalfamily/comments/8ojyya/super_confused_about_royal_baby_names_please_help/,False,,False,,,False,4,,{},"Hey, clueless foreigner here.

I have a burning question about royal baby names: is there a set ""pool"" of names a royal couple can choose from? Like is it mandated that the baby MUST be named after an ancestor/family member? Wouldn't they run out of names if so??

Also, how come all the babies are always called super traditionally English names, even when the baby name trends are leaning towards less traditional names? Would it be possible for a royal baby to be named, say, Maple or Bazuken or something?

This question has bothered me for literal months and months; I've googled but nothing really resolved these specific questions so huge thanks to anyone who answers.","&lt;!-- SC_OFF --&gt;&lt;div class=""md""&gt;&lt;p&gt;Hey, clueless foreigner here.&lt;/p&gt;

&lt;p&gt;I have a burning question about royal baby names: is there a set &amp;quot;pool&amp;quot; of names a royal couple can choose from? Like is it mandated that the baby MUST be named after an ancestor/family member? Wouldn&amp;#39;t they run out of names if so??&lt;/p&gt;

&lt;p&gt;Also, how come all the babies are always called super traditionally English names, even when the baby name trends are leaning towards less traditional names? Would it be possible for a royal baby to be named, say, Maple or Bazuken or something?&lt;/p&gt;

&lt;p&gt;This question has bothered me for literal months and months; I&amp;#39;ve googled but nothing really resolved these specific questions so huge thanks to anyone who answers.&lt;/p&gt;
&lt;/div&gt;&lt;!-- SC_ON --&gt;",True,False,False,royalfamily,t5_2xyim,r/royalfamily,751,public,,,Super confused about royal baby names please help a foreigner out,4,https://www.reddit.com/r/royalfamily/comments/8ojyya/super_confused_about_royal_baby_names_please_help/,[],,False,,
